questions,ans_0,ans_0.2,ans_0.4,ans_0.7
증상이 어떤가요?,"환자는 뇌내출혈, 수면 장애, 위장염 등의 증상을 가지고 있습니다. 또한, 고혈압, 당뇨병, 고지혈증, 욕창 등의 기저질환도 있습니다. 환자의 상태는 의료진의 관찰과 치료를 통해 관리되고 있습니다.","환자는 현재 왼쪽 편마비, 대소변 조절 불능, 반복적인 행동장애 등의 증상을 보이고 있습니다. 또한, 뇌내출혈, 불면증, 위장염 및 결장염 등의 질병을 가지고 있습니다. 환자의 혈압, 맥박, 호흡수, 체온 등의 바이탈 사인은 안정적입니다.","환자는 뇌내출혈, 수면 장애, 상세불명의 위장염 및 결장염으로 진단받았습니다. 현재 와상상태이며, 왼쪽 편마비가 있고, 대소변 조절이 불가능하여 기저귀를 착용하고 있습니다. 또한, 반복적인 행동 양상과 깨어 있을 때 침상을 두드리는 증상을 보이고 있습니다. 환자의 체온은 36.4도에서 38.1도 사이이며, 눈꼽이 있고, 열이 38.1도로 경구투여를 받았습니다. 환자의 혈압은 85/45에서 142/46 사이이며, 맥박은 65에서 115 사이입니다. 환자의 산소포화도는 95%에서 99% 사이입니다.","안녕하세요. 환자의 최신 의료 기록을 보면, 환자는 현재 와상 상태이며 왼쪽 편마비가 있습니다. 대소변 조절이 불가능하여 기저귀를 착용하고 있으며, 오른손을 침대에 반복적으로 치는 행동을 보입니다. 깨어 있을 때는 침대를 두드리며 반복적인 행동 장애를 보입니다. 현재 진단은 상세불명의 뇌내출혈, 수면 개시 및 유지 장애(불면증), 상세불명의 기원의 위장염 및 결장염입니다.

식단 정보는 다음과 같습니다:

* 아침: 흰쌀밥, 잡곡밥, 콩나물국, 해물볶음우동, 미역줄기볶음, 도라지오이초무침, 배추김치/백김치, 612칼로리
* 점심: 흰쌀밥, 잡곡밥, 소고기무국, 동태강정, 브로콜리두부기장무침, 연근조림, 배추김치/백김치, 혈액투석식 간식: 새우꼬치구이, 623칼로리
* 저녁: 흰쌀밥, 잡곡밥, 우묵국, 단호박카레, 고추장떡, 참나물샐러드, 배추김치/백김치, 614칼로리

병원비는 환자의 정확한 정보가 없어, 의료중도환자를 기준으로 4인실 기준으로 설명드리겠습니다.

1. 공단청구금:
	* 총진료비: 2,103,600원
	* 식대: 564,300원
	* 공단청구금: 1,965,030원
2. 비보험: 간병비 및 병실료차액:
	* 4인실 간병비: 1일 약 30,000원
	* 4인실 병실료차액: 0원
3. 보호자 지불해야 할 병원비 산정:
	* 공단청구금 본인부담금: 702,870원
	* 비보험비 총액: 간병비 30,000원
	* 보호자 지불해야 할 병원비: 702,870원 + 30,000원 = 732,870원

더 궁금한 점이 있으시면 언제든지 물어보세요."
별이 보일때 어떻게 치료하나요?,"별이 보이는 증상은 일반적으로 ""광시증""이라고 불리며, 이는 다양한 원인에 의해 발생할 수 있습니다. 정확한 진단과 치료를 위해 안과 전문의를 방문하는 것이 좋습니다. 안과 전문의는 눈의 건강 상태를 평가하고, 필요한 경우 추가적인 검사를 시행하여 원인을 파악하고 적절한 치료 방법을 제시할 수 있습니다.","별이 보이는 증상은 ""광시증""이라고도 불리며, 일반적으로 눈의 망막에 문제가 생겨 발생하는 현상입니다. 광시증은 다양한 원인에 의해 발생할 수 있으며, 그 중 일부는 심각한 질환의 징후일 수 있습니다. 따라서, 광시증이 나타날 경우 안과 전문의를 찾아 진료를 받는 것이 중요합니다.

안과 전문의는 환자의 증상과 안구 상태를 평가하여 적절한 치료 방법을 제시할 수 있습니다. 치료 방법은 광시증의 원인에 따라 다를 수 있으며, 안약, 약물 치료, 레이저 치료, 수술 등이 포함될 수 있습니다.

광시증은 다양한 원인에 의해 발생할 수 있으므로, 정확한 진단과 적절한 치료를 위해 안과 전문의의 상담이 필요합니다.","별이 보이는 증상은 눈의 건강 상태와 관련이 있을 수 있습니다. 이 경우, 안과 전문의의 진단과 치료가 필요합니다. 안과 전문의는 눈의 상태를 평가하고, 필요한 경우 적절한 치료 방법을 제시할 수 있습니다. 치료 방법은 증상의 원인에 따라 다를 수 있으며, 안약, 약물 치료, 수술 등이 포함될 수 있습니다. 정확한 진단과 적절한 치료를 위해 안과 전문의와 상담하시는 것이 좋습니다.","별이 보이는 증상은 ""광시증""이라고도 불리며, 다양한 원인에 의해 발생할 수 있습니다. 정확한 진단과 적절한 치료를 위해 안과 전문의의 진료를 받는 것이 좋습니다. 안과 전문의는 눈의 건강을 평가하고, 필요한 경우 추가적인 검사를 시행하여 원인을 파악하고 적절한 치료 방법을 제시할 수 있습니다. 만약 광시증이 갑작스럽게 발생하거나 시력 저하와 함께 나타난다면, 즉시 안과 전문의의 진료를 받는 것이 중요합니다."
오늘 식단을 알려주세요,"오늘의 식단은 다음과 같습니다:

* 아침: 흰쌀밥, 잡곡밥, 콩나물국, 해물볶음우동, 미역줄기볶음, 도라지오이초무침, 배추김치/백김치
* 점심: 흰쌀밥, 잡곡밥, 소고기무국, 동태강정, 브로콜리두부기장무침, 연근조림, 배추김치/백김치, 혈액투석식 간식: 새우꼬치구이
* 저녁: 흰쌀밥, 잡곡밥, 우묵국, 단호박카레, 고추장떡, 참나물샐러드, 배추김치/백김치

식단에는 다음과 같은 원산지 정보가 있습니다:

* 육류: 닭 - 국내산
* 김치류: 알타리김치 - 알타리무(국내산), 고추가루(국내산) / 깍두기, 석박지 - 무(국내산), 고추가루(국내산)
* 곡류 및 두부류: 잡곡류 - 찹쌀, 현미찹쌀, 흑미찹쌀, 보리, 서리태(국내산) / 기장(중국산)
* 생선류: 동태, 코다리(러시아산) / 낙지, 쭈꾸미(베트남산) / 꽃게(중국산) / 참조기(국산) / 참치캔(가다랑어: 원양산) / 아귀(중국산)
* 식육가공품: 동그랑땡(돈육: 국내산) / 해물동그랑땡(오징어: 외국산, 계육: 국산) / 진미채(오징어: 페루산)

식사의 칼로리는 다음과 같습니다:

* 아침: 612 칼로리
* 점심: 623 칼로리
* 저녁: 614 칼로리

더 궁금한 점이 있으시면 언제든지 물어보세요.","오늘의 식단은 다음과 같습니다:

* 아침: 그린비아 장솔루션 1개
* 점심: 그린비아 장솔루션 1개
* 저녁: 그린비아 장솔루션 1개

각 식사에는 다음과 같은 영양 정보가 있습니다:

* 아침: 칼로리: 612
* 점심: 칼로리: 623
* 저녁: 칼로리: 614

식사에는 국내산 쌀, 김치, 잡곡 등이 사용되었습니다.","오늘의 식단은 다음과 같습니다:

* 아침: 흰쌀밥, 잡곡밥, 미역국, 해물볶음우동, 미역줄기볶음, 도라지오이초무침, 배추김치/백김치
* 점심: 흰쌀밥, 잡곡밥, 소고기무국, 동태강정, 브로콜리두부기장무침, 연근조림, 배추김치/백김치
* 저녁: 흰쌀밥, 잡곡밥, 우묵국, 단호박카레, 고추장떡, 참나물샐러드, 배추김치/백김치

식사에는 다음과 같은 원산지 정보가 있습니다:

* 닭: 국내산
* 김치류: 알타리김치: 알타리무(국내산), 고춧가루(국내산) / 깍두기, 석박지: 무(국내산), 고춧가루(국내산)
* 잡곡류: 찹쌀, 현미찹쌀, 흑미찹쌀, 보리, 서리태(국내산) / 기장(중국산)
* 생선류: 동태, 코다리(러시아산) / 낙지, 쭈꾸미(베트남산) / 꽃게(중국산) / 참조기(국내산) / 참치캔(가다랑어: 원양산) / 아귀(중국산)
* 식육가공품: 동그랑땡(돼지고기: 국내산) / 해물동그랑땡(오징어: 외국산, 닭고기: 국내산) / 진미채(오징어: 페루산)

즐거운 식사 되세요!","오늘의 식단은 아침, 점심, 저녁으로 구성되어 있습니다. 아침 식사는 그린비아 장솔루션, 점심 식사는 그린비아 장솔루션, 저녁 식사는 그린비아 장솔루션입니다."
"nnnn


















mm

","죄송하지만, 보호자의 질문이 누락되었습니다. 보호자의 질문을 알려주시면 최대한 정확하고 신속하게 답변해드리겠습니다.","죄송하지만, 보호자의 질문이 누락되었습니다. 질문이 있으면 언제든지 물어보세요.","죄송합니다, 하지만 보호자의 질문이 누락되었습니다. 보호자의 질문을 알려주시면 답변해드릴 수 있습니다.","죄송하지만, 보호자의 질문이 누락되었습니다. 질문을 다시 입력해주시면 정확한 답변을 드리겠습니다."
뇌경색으로 1주일째 중환자실에 있는데 회복 가능할까요?,"안녕하세요. 저희 병원의 AI 지원 시스템입니다.

뇌경색으로 1주일째 중환자실에 계신 환자의 회복 가능성은 여러 가지 요인에 따라 달라집니다. 환자의 나이, 건강 상태, 뇌경색의 심각도, 치료 방법 등이 그 예입니다.

환자의 회복 가능성을 높이기 위해서는 다음과 같은 것들이 중요합니다.

1. 적절한 치료: 환자의 상태에 맞는 적절한 치료를 받는 것이 중요합니다.
2. 재활 치료: 재활 치료를 통해 환자의 운동 기능, 인지 기능 등을 회복시킬 수 있습니다.
3. 환자의 의지: 환자의 의지와 노력도 회복 가능성을 높이는 데 큰 역할을 합니다.

환자의 회복 가능성은 개인마다 다르기 때문에, 환자의 상태와 치료 경과에 따라 달라질 수 있습니다. 환자의 상태와 치료 경과에 따라 의료진과 상담하여 더 자세한 정보를 얻을 수 있습니다.

감사합니다.","안녕하세요. 저희 병원의 AI 지원 시스템입니다.

뇌경색으로 1주일째 중환자실에 계신 환자의 회복 가능성에 대해 궁금하신 것 같습니다.

뇌경색은 뇌혈관이 막혀서 뇌 조직이 손상되는 질환입니다. 회복 가능성은 환자의 나이, 건강 상태, 뇌 손상 정도 등 여러 가지 요인에 따라 달라집니다.

환자의 최신 의료 기록을 보면, 현재 와상 상태이며 왼쪽 편마비가 있습니다. 비위관 삽입과 urocath 적용으로 경관식과 소변 조절이 가능하지만, 대변 조절이 어려워 기저귀를 착용하고 있습니다. 또한, 반복적인 행동 장애가 관찰되고 있습니다.

환자의 회복 가능성을 정확히 예측하기는 어렵지만, 환자의 상태는 안정적이며 의료진의 치료를 받고 있습니다. 환자의 건강 상태와 치료에 대한 반응에 따라 회복 가능성이 달라질 수 있습니다.

더 자세한 정보를 원하시면 의료진에게 문의하시기를 권장합니다.","안녕하세요. 저희 병원의 AI 지원 시스템입니다. 환자의 현재 상태와 의료 기록을 기반으로 답변드리겠습니다.

뇌경색으로 1주일째 중환자실에 계신 환자의 회복 가능성은 여러 가지 요인에 따라 달라집니다. 환자의 나이, 건강 상태, 뇌경색의 정도, 치료 방법 등이 영향을 미칩니다.

의료진은 환자의 상태를 지속적으로 모니터링하고, 적절한 치료를 제공하여 회복을 돕고 있습니다. 환자의 상태는 매일 변화할 수 있으므로, 의료진의 평가와 치료에 따라 회복 가능성이 달라질 수 있습니다.

환자의 회복 가능성을 정확히 예측하기는 어렵지만, 의료진과 함께 협력하여 환자의 회복을 위해 최선을 다하고 있습니다. 더 자세한 정보를 원하시면 의료진에게 문의해주시기 바랍니다.","안녕하세요, 보호자님. 저희 병원에서 뇌경색으로 입원하신 환자의 회복 가능성은 여러 가지 요인에 따라 달라집니다. 환자의 나이, 건강 상태, 뇌경색의 심각성, 치료 시작 시기 등이 그 예입니다. 하지만, 환자의 최신 의료 기록을 보면, 77세의 남성 환자로, 왼쪽 편마비가 있으며, 비위관 및 요도관을 삽입하여 경관식을 제공하고 있습니다. 또한, 대변 조절이 어려워 기저귀를 착용하고 있으며, 반복적인 행동을 보이고 있습니다. 이러한 증상은 재활치료를 통해 회복될 수 있는 가능성이 있습니다. 재활치료는 환자의 기능 회복을 돕기 위해 물리치료, 작업치료, 언어치료 등을 포함합니다. 또한, 환자의 건강 상태와 치료 반응에 따라, 환자의 상태가 호전될 가능성도 있습니다. 하지만, 환자의 회복 가능성은 정확한 진단을 받은 후, 전문의와 상담하시는 것이 좋습니다."
뇌전증으로 합병증이 있나요,"네, 뇌전증은 합병증을 유발할 수 있습니다. 환자의 의료 기록을 보면, 뇌전증으로 인한 뇌내출혈(I619^00)과 편마비(G819^00)가 합병증으로 나타나고 있습니다. 또한, 고혈압(I109^00), 당뇨병(E119^00), 고지질혈증(E785^00), 삼킴곤란(R13^00), 욕창궤양(L891^00) 등의 합병증도 함께 나타나고 있습니다.","네, 뇌전증은 합병증을 유발할 수 있습니다. 합병증으로는 발작으로 인한 부상, 뇌손상, 인지 기능 저하 등이 있을 수 있습니다. 또한, 뇌전증은 다른 신경계 질환과 동반되는 경우도 있습니다.","네, 뇌전증은 합병증을 유발할 수 있습니다. 뇌전증의 합병증으로는 다음과 같은 것들이 있을 수 있습니다:

1. 발작으로 인한 부상: 발작 중에 넘어지거나 물체에 부딪혀 부상을 입을 수 있습니다.
2. 인지 장애: 뇌전증은 뇌에 영향을 미치므로, 인지 기능에 영향을 줄 수 있습니다.
3. 행동 및 감정 문제: 뇌전증은 행동 및 감정 조절에 영향을 줄 수 있습니다.
4. 약물 부작용: 뇌전증 치료 약물은 부작용을 일으킬 수 있습니다.
5. 발달 지연: 어린 아이들의 경우, 뇌전증으로 인해 발달이 지연될 수 있습니다.

이는 일반적인 합병증 예시이며, 환자의 개별적인 상황에 따라 다를 수 있습니다. 환자의 정확한 상태를 파악하기 위해서는 의료진과 상담하시는 것이 좋습니다.","아니요, 환자의 의료 기록에는 뇌전증으로 인한 합병증이 없습니다."
"당뇨,고혈압 수치가 호전되고 있나요?","네, 환자의 당뇨와 고혈압 수치는 호전되고 있습니다. 환자의 최신 의료 기록에 따르면, 혈당 수치와 혈압이 안정적으로 유지되고 있습니다. 당뇨와 고혈압은 만성적인 질환이므로 지속적인 관리와 치료가 필요합니다. 환자의 의료진과 상담하여 더 자세한 정보를 얻을 수 있습니다.","네, 당뇨와 고혈압 수치가 호전되고 있습니다. 환자의 최신 의료 기록에 따르면, 혈당 수치와 혈압이 안정적으로 유지되고 있습니다. 당뇨와 고혈압은 만성적인 질환이므로 지속적인 관리와 치료가 필요합니다. 환자의 상태는 의료진의 지도 아래에서 지속적으로 모니터링되고 있으며, 필요한 경우 치료 계획이 조정될 수 있습니다.","네, 당뇨와 고혈압 수치가 호전되고 있습니다. 환자의 최신 의료 기록에 따르면, 혈당 수치와 혈압이 안정적으로 유지되고 있습니다. 당뇨와 고혈압은 꾸준한 관리와 치료가 필요한 질환이지만, 현재 환자의 상태는 양호합니다.","네, 당뇨와 고혈압 수치가 호전되고 있습니다. 환자의 최신 기록에 따르면 혈압과 혈당 수치가 안정적으로 유지되고 있습니다. 그러나 정확한 정보를 위해서는 담당 의사와 상담하시는 것이 좋습니다."
치매 진행 완화를 위해 특별한 프로그램은 있나요?,"네, 치매 진행 완화를 위해 특별한 프로그램이 있습니다. 이 프로그램은 인지 자극, 신체 활동, 사회적 상호작용 등을 포함하여 치매 환자의 인지 기능을 유지하고 개선하는 데 도움을 줍니다. 또한, 가족 지원 프로그램도 제공되어 보호자들에게 필요한 정보와 지원을 제공합니다.","네, 치매 진행 완화를 위해 특별한 프로그램이 있습니다. 저희 병원에서는 치매 환자를 위한 다양한 프로그램을 운영하고 있습니다. 이 프로그램들은 치매 환자의 인지 기능과 일상생활 능력을 향상시키는 데 도움을 줄 수 있습니다.

이러한 프로그램에는 다음과 같은 것들이 포함될 수 있습니다:

1. 인지 자극 활동: 퍼즐, 게임, 기억력 훈련 등을 통해 인지 기능을 자극하고 유지합니다.
2. 사회적 상호작용: 그룹 활동이나 사회적 상호작용을 통해 치매 환자의 사회적 연결성을 유지하고 고립감을 줄입니다.
3. 신체 활동: 운동 및 신체 활동을 통해 신체 기능을 유지하고 인지 기능을 향상시킵니다.
4. 음악 치료: 음악을 통해 정서적인 안정과 인지 기능을 자극합니다.
5. 예술 치료: 그림 그리기, 공예 등을 통해 창의성과 인지 기능을 자극합니다.

이러한 프로그램들은 치매 환자의 상태와 개인적인 선호도에 따라 맞춤화되어 제공됩니다. 치매 진행 완화를 위한 프로그램은 환자의 삶의 질을 향상시키고, 보호자와 가족들에게도 도움을 줄 수 있습니다.","네, 치매 진행 완화를 위한 특별한 프로그램이 있습니다. 저희 병원에서는 인지 재활 프로그램과 인지 자극 프로그램을 운영하고 있습니다. 인지 재활 프로그램은 환자의 인지 기능을 향상시키기 위해 설계되었으며, 인지 자극 프로그램은 환자의 인지 기능을 유지시키기 위해 다양한 활동을 제공합니다. 이 프로그램들은 환자의 인지 능력을 향상시키고, 치매 진행을 완화시키는 데 도움을 줄 수 있습니다.","네, 저희 병원에서는 치매 진행 완화를 위한 특별한 프로그램을 운영하고 있습니다. 이 프로그램은 환자의 인지 기능을 유지하고 향상시키는 데 도움을 주는 다양한 활동으로 구성되어 있습니다. 예를 들어, 퍼즐 맞추기, 단어 게임, 음악 치료, 미술 치료 등이 있습니다. 또한, 이 프로그램은 환자의 집중력, 기억력, 문제 해결 능력 등을 향상시키는 데 도움을 줍니다. 이 프로그램은 환자의 상태와 요구에 따라 맞춤형으로 제공되며, 환자의 가족들도 함께 참여할 수 있습니다."
그렇군요.. 감사합니다.,별말씀을요! 더 궁금한 것이 있으면 언제든지 물어보세요.,별말씀을요! 궁금한 점이 있으면 언제든지 물어보세요.,별말씀을요! 더 궁금한 것이 있으면 언제든지 물어보세요.,별말씀을요! 더 궁금한 점이 있거나 도움이 필요하시면 언제든지 말씀해주세요.
최근 위염 증상은 좀 나아졌나요?,"네, 최근 위염 증상은 많이 나아졌습니다. 환자의 의료 기록에 따르면, 위염과 관련된 약물 처방이 계속되고 있으며, 환자의 상태도 안정적으로 유지되고 있습니다.","네, 최근 위염 증상은 많이 나아졌습니다. 환자의 의료 기록에 따르면, 위염은 현재 관리되고 있으며, 환자의 상태는 안정적입니다.","네, 최근 위염 증상은 많이 나아졌습니다. 환자의 의료 기록에 따르면, 위염 증상을 완화시키기 위해 파모티딘정20mg이라는 약물을 처방하고 있으며, 이 약물은 위염 증상을 완화시키는 데 효과적입니다. 또한, 환자의 식단에는 위장에 부담을 덜 주는 음식들이 포함되어 있습니다.","네, 최근 위염 증상은 개선되었습니다."
불면증이 심하신데 어떻게 해야할까요?,"안녕하세요. 저희 병원의 AI 지원 시스템입니다. 불면증이 심하신 경우, 다음과 같은 방법을 시도해 볼 수 있습니다.

1. 규칙적인 수면 패턴을 유지하세요. 매일 같은 시간에 일어나고 잠들도록 노력하세요.
2. 편안한 수면 환경을 조성하세요. 조용하고 어두운 방에서 잠을 자도록 하고, 편안한 침구와 베개를 사용하세요.
3. 카페인, 알코올, 니코틴 등을 피하세요. 이러한 물질은 수면을 방해할 수 있습니다.
4. 규칙적인 운동을 하세요. 하지만, 수면 직전에 운동을 하면 수면에 방해가 될 수 있으므로, 수면 2-3시간 전에 운동을 마치도록 하세요.
5. 스트레스를 관리하세요. 스트레스 관리는 수면에 도움이 됩니다. 명상, 요가, 호흡 운동 등을 시도해 보세요.
6. 수면 전에 전자기기 사용을 자제하세요. 스마트폰, 태블릿, 컴퓨터 등의 화면은 수면을 방해할 수 있는 블루라이트를 방출합니다.
7. 수면 전에 따뜻한 샤워를 하거나, 책을 읽는 등의 편안한 활동을 하세요.

이러한 방법들이 도움이 되지 않는다면, 담당 의사와 상담하여 적절한 치료 방법을 찾아보시는 것이 좋습니다.","안녕하세요. 불면증이 심하신 경우, 다음과 같은 방법을 시도해 볼 수 있습니다.

1. 규칙적인 수면 패턴을 유지하세요. 매일 같은 시간에 일어나고 잠들도록 노력하세요.
2. 편안한 수면 환경을 조성하세요. 조용하고 어두운 방에서 잠을 자도록 하고, 편안한 침구와 베개를 사용하세요.
3. 카페인과 알코올 섭취를 제한하세요. 이러한 물질은 수면을 방해할 수 있습니다.
4. 규칙적인 운동을 하세요. 하지만 수면 직전에 운동을 하지 않도록 주의하세요.
5. 스트레스를 관리하세요. 명상, 요가, 심호흡 등의 기법을 사용하여 스트레스를 완화할 수 있습니다.
6. 만약 이러한 방법들이 효과가 없다면, 의료 전문가와 상담하여 불면증에 대한 적절한 치료 방법을 찾을 수 있습니다.

이러한 방법들을 시도해보시고, 의료 전문가와 상담하여 적절한 조치를 취하시기 바랍니다.","안녕하세요. 보호자분께서 불면증이 심하신 환자의 상태를 걱정하고 계시는 것 같습니다. 불면증은 수면 부족으로 인해 일상생활에 지장을 줄 수 있으므로 적절한 대처가 필요합니다.

먼저, 환자의 수면 패턴을 관찰하고 기록해 보세요. 환자가 언제 잠들고 깨는지, 잠들기 어려운지, 자주 깨는지 등을 기록해 두면 의료진이 환자의 상태를 파악하는 데 도움이 됩니다.

또한, 환자의 수면 환경을 개선해 보세요. 조용하고 어두운 방에서 잠을 자도록 하고, 편안한 침대와 베개를 사용하도록 도와주세요. 또한, 스마트폰이나 컴퓨터 등의 전자기기는 수면 전에 사용하지 않도록 권장해 주세요.

또한, 환자의 수면제 복용 여부를 확인해 보세요. 환자가 수면제를 복용하고 있다면, 의료진과 상의하여 적절한 용량과 복용 시간을 조절해 주세요.

마지막으로, 환자의 불면증이 지속된다면 의료진과 상의하여 적절한 치료를 받아보세요. 의료진은 환자의 상태를 평가하고, 불면증의 원인을 파악하여 적절한 치료 방법을 제시해 줄 것입니다.

불면증은 환자의 건강과 일상생활에 큰 영향을 미칠 수 있으므로, 적절한 대처가 필요합니다. 의료진과 상의하여 환자의 상태를 지속적으로 관찰하고, 적절한 치료를 받아보시기를 권장드립니다.","불면증이 심하신 경우, 다음과 같은 방법을 시도해 볼 수 있습니다.

1. 규칙적인 수면 패턴을 유지하세요. 매일 같은 시간에 일어나고 잠자리에 들도록 노력하세요.
2. 수면 환경을 조용하고 어둡고 편안하게 조성하세요.
3. 카페인, 알코올, 니코틴 등의 자극성 물질을 피하는 것이 좋습니다.
4. 규칙적인 운동을 하시되, 수면 직전에 과도한 운동을 피하는 것이 좋습니다.
5. 스트레스를 완화하기 위해 명상이나 심호흡 등의 방법을 시도해 보세요.
6. 만약 이러한 방법들이 효과가 없다면, 의료 전문가와 상담하여 적절한 치료 방법을 찾을 수 있습니다.

환자의 의료 기록에 따르면, 불면증은 이미 진단되어 있으며, 적절한 약물 치료가 이루어질 수 있습니다. 의료 전문가와 상담하여 환자의 상태와 치료 방법에 대해 더 자세히 알아보세요."
