questions,ans_0,ans_0.2,ans_0.4,ans_0.7
지금은소변만 실수하는데 병윈 에 모셔야할까요?,"안녕하세요! 저희 병원의 AI 지원 시스템입니다.

환자의 현재 상태로는 소변만 실수하는 경우, 병원에서 모시는 것이 좋습니다. 환자의 의료 기록에 따르면, 대소변 조절이 불가능하여 기저귀를 착용하고 있습니다. 또한, 환자의 상태에 따라 지속적인 관찰과 관리가 필요할 수 있습니다.

병원에서 모시는 경우, 환자의 상태를 지속적으로 관찰하고, 필요한 조치를 취할 수 있습니다. 또한, 환자의 상태에 따라 적절한 치료와 관리를 제공할 수 있습니다.

병원에서 모시는 비용은 환자의 상태와 병실 종류, 간병인 여부 등에 따라 다를 수 있습니다. 병원에서 모시는 비용에 대한 자세한 정보는 저희 병원 상담센터로 문의해주시기 바랍니다.

감사합니다.","보호자님, 현재 환자의 상태는 소변만 실수하는 것으로 보입니다. 이러한 경우, 환자의 상태를 관찰하면서 적절한 조치를 취하는 것이 중요합니다. 환자의 상태를 지속적으로 관찰하고, 필요한 경우 의료진과 상담하여 적절한 조치를 취하시기 바랍니다.","안녕하세요.

보호자분께서 현재 환자의 상태와 관련하여 문의하셨군요. 환자가 소변만 실수하는 경우, 병원에서 모셔야 할지에 대한 질문이신가요?

저희 병원에서는 환자의 상태와 필요에 따라 개별적인 돌봄 계획을 수립합니다. 환자의 현재 상태와 돌봄 요구사항에 대해 의료진과 상담하시는 것이 좋습니다. 의료진은 환자의 상태와 필요에 따라 적절한 돌봄 계획을 제시해 드릴 것입니다.

의료진과의 상담을 통해 환자의 상태와 돌봄 요구사항에 대해 자세히 알아보고, 병원에서 모셔야 할지에 대한 결정을 내리실 수 있습니다.

더 궁금한 사항이 있으시면 언제든지 문의해주세요.","환자분의 건강 상태는 현재 소변만 실수하는 것으로 보입니다. 그러나, 환자분의 건강 상태와 병원 입원 여부는 의료진과 상의하시는 것이 가장 좋습니다. 의료진은 환자의 상태와 치료 계획을 고려하여 입원 여부를 결정할 수 있습니다. 또한, 의료진과 상의하여 환자의 건강 상태에 대한 더 자세한 정보를 얻을 수 있습니다."
요즘 등이 가끔 간지럽고 쑤시는데 무슨 증상일까요?,"안녕하세요! 등이 가끔 간지럽고 쑤시는 증상은 다양한 원인에 의해 발생할 수 있습니다. 몇 가지 가능한 원인을 알려드리겠습니다:

1. 근육 긴장: 일상적인 활동이나 잘못된 자세로 인해 등이 긴장되어 간지러움과 쑤시는 증상이 나타날 수 있습니다.
2. 피부 질환: 피부염, 습진, 알레르기 반응 등의 피부 질환으로 인해 등이 간지럽고 쑤실 수 있습니다.
3. 신경통: 신경통은 신경이 압박되거나 자극을 받을 때 발생할 수 있는 통증으로, 등이 쑤시는 증상을 유발할 수 있습니다.
4. 척추 문제: 척추 디스크의 변위, 척추측만증, 척추관 협착증 등의 척추 문제로 인해 등이 쑤시는 증상이 나타날 수 있습니다.

이러한 증상이 지속되거나 심해진다면 의료 전문가와 상담하여 정확한 진단과 치료를 받는 것이 좋습니다.","보호자님,

최근 등이 간지럽고 쑤시는 증상은 다양한 원인으로 인해 발생할 수 있습니다. 몇 가지 가능한 원인을 알려드리겠습니다:

1. 근육 긴장 또는 피로: 일상적인 활동이나 장시간 앉아있는 자세로 인해 등이 긴장되거나 피로할 수 있습니다.
2. 척추 문제: 허리 디스크, 척추측만증, 척추관 협착증 등의 척추 문제로 인해 등이 간지럽고 쑤실 수 있습니다.
3. 피부 질환: 피부염, 건선, 습진 등의 피부 질환으로 인해 등이 간지럽고 쑤실 수 있습니다.
4. 신경통: 신경통이나 신경압박으로 인해 등이 쑤실 수 있습니다.
5. 기타 원인: 감염, 종양, 대사 이상 등의 다른 원인으로 인해 등이 간지럽고 쑤실 수도 있습니다.

이러한 증상이 지속되거나 심해진다면 의료 전문가와 상담하여 정확한 진단과 치료를 받는 것이 좋습니다. 의료진은 증상을 평가하고 필요한 검사를 통해 원인을 파악한 후 적절한 치료 방법을 제시해 줄 것입니다.

감사합니다.","안녕하세요! 등이 가끔 간지럽고 쑤시는 증상은 여러 가지 원인이 있을 수 있습니다. 몇 가지 가능성을 살펴보겠습니다.

1. 근육통: 등이 쑤시는 경우 근육통이 원인일 수 있습니다. 근육통은 근육의 피로, 긴장 또는 부상으로 인해 발생할 수 있습니다.
2. 관절통: 등이 쑤시는 경우 관절통이 원인일 수도 있습니다. 관절통은 관절의 염증, 부상 또는 퇴행성 변화로 인해 발생할 수 있습니다.
3. 신경통: 등이 쑤시는 경우 신경통이 원인일 수도 있습니다. 신경통은 신경의 압박, 염증 또는 손상으로 인해 발생할 수 있습니다.
4. 피부 질환: 등이 간지럽고 쑤시는 경우 피부 질환이 원인일 수도 있습니다. 피부 질환은 피부염, 알레르기 반응 또는 감염 등으로 인해 발생할 수 있습니다.

이러한 증상이 계속되거나 심해진다면 의료 전문가와 상담하여 정확한 진단과 치료를 받는 것이 좋습니다. 의료 전문가는 증상을 평가하고 적절한 조치를 취해줄 수 있습니다.

등 증상이 심하지 않고 일시적인 경우, 휴식, 온열 또는 냉찜질, 스트레칭, 적절한 자세 유지 등을 시도해 볼 수 있습니다. 그러나 증상이 계속되거나 심해진다면 의료 전문가와 상담하는 것이 좋습니다.","보호자분께서 등이 가끔 간지럽고 쑤시는 증상은 다양한 원인이 있을 수 있습니다. 몇 가지 가능한 원인은 다음과 같습니다:

1. 근육 긴장: 일상적인 활동이나 잘못된 자세로 인해 등이 긴장되어 간지러움과 쑤시는 증상이 나타날 수 있습니다.
2. 척추 문제: 척추 디스크의 손상, 척추염 또는 척추 관련 문제로 인해 등이 쑤시고 간지러울 수 있습니다.
3. 피부 문제: 피부 질환이나 알레르기 반응으로 인해 등이 간지럽고 쑤시는 증상이 발생할 수 있습니다.
4. 신경 문제: 신경 압박이나 신경 손상으로 인해 등이 쑤시고 간지러울 수 있습니다.

이러한 증상이 계속되거나 심해진다면 의료 전문가와 상담하여 정확한 진단과 적절한 치료를 받는 것이 좋습니다."
감사합니다,감사합니다. 더 궁금한 것이 있으면 언제든지 물어보세요.,별말씀을요! 궁금한 것이 있으면 언제든지 물어보세요.,감사합니다. 궁금한 점이나 도움이 필요하신 것이 있으면 언제든지 말씀해주세요.,별말씀을요! 더 도와드릴 게 있으면 언제든지 말씀해주세요.
당뇨식단,"당뇨식단에 대해 궁금하신가요? 당뇨식단은 혈당 조절을 위해 중요한 역할을 합니다. 당뇨식단은 탄수화물, 단백질, 지방의 균형을 맞추고, 식이섬유와 영양소가 풍부한 식품을 선택하는 것이 중요합니다.

다음은 당뇨식단의 주요 원칙입니다:

1. 탄수화물 섭취량 조절: 탄수화물은 혈당을 상승시키므로, 적절한 양의 탄수화물을 섭취해야 합니다. 식사 때마다 탄수화물 양을 조절하고, 식이섬유가 풍부한 탄수화물을 선택하는 것이 좋습니다.
2. 균형 잡힌 식사: 단백질과 지방도 균형 있게 섭취해야 합니다. 단백질은 근육을 유지하고, 지방은 에너지 공급과 영양소 흡수에 도움을 줍니다.
3. 식이섬유 섭취: 식이섬유는 혈당 상승을 완화시키고, 포만감을 유지시켜 과식을 방지합니다. 과일, 채소, 곡류 등 식이섬유가 풍부한 식품을 섭취하는 것이 좋습니다.
4. 당류 섭취 제한: 당류는 혈당을 급격하게 상승시키므로, 당류 섭취를 제한하는 것이 좋습니다. 단맛을 대체할 수 있는 천연 감미료를 사용하는 것도 좋은 방법입니다.
5. 규칙적인 식사: 규칙적인 식사는 혈당 조절에 도움을 줍니다. 일정한 시간에 식사를 하고, 간식을 적절히 섭취하는 것이 좋습니다.

당뇨식단은 개인의 상태와 요구에 따라 다를 수 있으므로, 의료 전문가와 상담하여 개인에게 맞는 식단을 계획하는 것이 좋습니다.",안녕하세요! 저희 병원 AI 지원 시스템에 문의해 주셔서 감사합니다. 당뇨식단에 대해 궁금하신 내용이 있나요? 저희가 도와드릴 수 있는 내용이라면 최대한 쉽게 설명해 드리겠습니다.,"당뇨식단은 당뇨병 환자들이 혈당 조절을 위해 섭취해야 하는 식단입니다. 일반적으로 당뇨식단은 탄수화물, 단백질, 지방 등의 영양소를 균형 있게 섭취하도록 구성됩니다. 또한, 당분이 많은 음식이나 고열량 음식은 제한하거나 피해야 합니다.

다음은 당뇨식단의 주요 원칙입니다:

1. 탄수화물 섭취량 조절: 탄수화물은 혈당을 올리는 주요한 영양소입니다. 당뇨식단에서는 적절한 양의 탄수화물을 섭취하도록 조절합니다.
2. 균형 잡힌 식사: 단백질과 지방도 중요한 영양소이므로, 탄수화물, 단백질, 지방을 균형 있게 섭취하는 것이 좋습니다.
3. 식이섬유 섭취: 식이섬유는 혈당 조절에 도움을 주므로, 과일, 채소, 곡류 등의 식이섬유가 풍부한 식품을 섭취하는 것이 좋습니다.
4. 당분이 많은 음식 제한: 설탕, 사탕, 과자, 음료수 등 당분이 많은 음식은 혈당을 급격히 올리기 때문에 제한하거나 피해야 합니다.
5. 규칙적인 식사: 규칙적인 식사는 혈당 조절에 도움을 주므로, 일정한 시간에 식사를 하는 것이 좋습니다.

환자의 최신 의료 기록을 보면, 경관식(그린비아 장솔루션)을 섭취하고 있습니다. 이는 당뇨식단의 일부로, 환자의 영양 요구를 충족시키기 위해 특별히 설계된 영양식입니다.

또한, 당뇨식단의 영양 성분은 다음과 같습니다:

- 아침: 612칼로리
- 점심: 623칼로리
- 저녁: 614칼로리

당뇨식단에 대한 자세한 내용은 담당 의사나 영양사와 상담하시는 것이 좋습니다.","당뇨식단에 대해 안내해 드리겠습니다. 당뇨병은 혈당 조절에 문제가 있는 만성 질환입니다. 당뇨식단은 혈당 조절을 돕고 당뇨병과 관련된 합병증을 예방하기 위해 중요합니다.

1. 탄수화물 섭취 조절: 탄수화물은 혈당을 상승시키므로 적절한 양의 탄수화물을 섭취해야 합니다. 식사할 때 쌀, 빵, 면, 감자 등의 탄수화물 섭취를 적절히 조절하세요.
2. 단백질과 식이섬유 섭취: 단백질과 식이섬유가 풍부한 식품을 섭취하여 포만감을 유지하고 혈당 상승을 완화할 수 있습니다. 닭고기, 생선, 두부, 채소, 과일 등을 다양하게 섭취하세요.
3. 당류와 포화지방 섭취 제한: 당류와 포화지방이 많은 음식은 혈당 조절에 영향을 줄 수 있으므로 제한하는 것이 좋습니다. 단맛이 강한 음료, 과자, 케이크, 튀긴 음식 등을 자제하세요.
4. 규칙적인 식사: 규칙적인 식사 시간을 유지하여 혈당을 안정적으로 관리할 수 있습니다. 일정한 시간에 균형 잡힌 식사를 하세요.
5. 식사 전 손 씻기: 식사 전에 손을 깨끗이 씻어 감염 예방에 신경을 쓰세요.
6. 의사와 영양사의 지도: 당뇨식단은 개인의 상태와 질병 진행에 따라 다를 수 있으므로 의사와 영양사와 상담하여 개인 맞춤형 식단을 계획하는 것이 좋습니다.

이러한 당뇨식단을 따르면서 건강한 식품 선택을 하고, 규칙적인 운동과 함께 혈당 조절을 도와 건강한 삶을 유지할 수 있습니다."
현 상태,"환자는 현재 312호에 있으며, 77세 남성입니다. 환자는 왼쪽 편마비가 있으며, 와상 상태입니다. L-tube (18Fr)가 유지되고 있으며, 장솔루션 400-400-400kcal/day가 경관식으로 제공되고 있습니다. 대소변 조절이 불가능하여 기저귀를 착용하고 있으며, 기저귀마다 변이 조금씩 매달려 있습니다. 환자는 계속해서 오른손으로 침대 난간을 툭툭 치는 반복적인 행동을 보이고 있습니다. 욕창 예방을 위해 에어매트를 사용하고 있으며, 체위 변경과 등마사지를 시행하고 있습니다. 낙상 예방을 위해 침대 난간을 올려놓고, 정서적인 간호를 제공하고 있습니다. 환자의 전반적인 상태는 관찰 중이며, 반복적인 행동 장애가 관찰되고 있습니다.","환자는 현재 18Fr의 튜브를 유지하고 있으며, 경관식 장솔루션 400-400-400kcal/day를 받고 있습니다. 대소변 조절이 불가능하여 기저귀를 착용하고 있으며, 기저귀마다 변이 조금씩 묻어나옵니다. 환자는 계속해서 오른손으로 침대 난간을 툭툭 치는 반복적인 행동을 보이고 있습니다. 욕창 예방을 위해 에어매트를 사용하고 있으며, 체위 변경과 등 마사지를 시행하고 있습니다. 낙상 예방을 위해 침상 난간을 올려놓고, 정서적인 간호를 제공하고 있습니다. 환자의 전반적인 상태는 관찰 중이며, 반복적인 행동 장애가 관찰되고 있습니다.","보호자님, 현재 환자의 상태는 와상상태이며 왼쪽 편마비가 있습니다. L-tube (18Fr)를 유지하고 있으며, 장솔루션 400-400-400kcal/day를 경관식으로 섭취하고 있습니다. 대소변 조절이 어려워 기저귀를 착용하고 있으며, 기저귀마다 변이 조금씩 매달려 나옵니다. 또한, 오른손으로 침대 난간을 툭툭 치는 반복적인 행동을 보이고 있습니다.

현재 환자의 혈압은 113/66, 맥박은 67, 호흡은 19, 체온은 36.5도입니다. 욕창 coccyx G1 2 x 2 x 0cm이 있으며, 욕창 부위에 드레싱을 시행하고 에어매트를 적용하고 있습니다. 또한, 체위 변경을 시행하고 있으며, 욕창 발생 부위의 피부 상태를 관찰하고 있습니다.

환자는 정서적인 간호와 전반적인 상태 관찰이 필요하며, 깨어 있을 때는 항상 침상을 두드리며 반복적인 행동 장애를 보입니다. 환자의 상태는 지속적으로 모니터링되고 있으며, 의료진은 환자의 상태를 개선하기 위해 노력하고 있습니다.","환자는 현재 왼쪽 편마비와 대소변 조절이 불가능한 상태로, 기저귀를 착용하고 있습니다. 경관식 장솔루션 400/400/400kcal/day를 공급받고 있으며, L-tube (18Fr)를 유지하고 있습니다. 환자는 반복적인 행동 양상을 보이며, 침대에 누워있는 동안에는 침상 두드리기와 정서적인 간호가 필요합니다. 욕창 coccyx G1 2 x 2 x 0cm을 관찰하였습니다. 환자의 바이탈 사인은 BP;125 BPL;64 P;73 RESP;19 T;36.2입니다. 환자의 상태는 전반적으로 안정적입니다."
의료기록을 확인하려면 직접 내원해야 하나요?,"네, 의료기록을 확인하려면 직접 내원하셔야 합니다. 의료기록은 환자의 개인정보와 건강상태를 담고 있기 때문에, 환자의 동의 없이 제3자에게 공개할 수 없습니다. 따라서, 의료기록을 확인하려면 환자가 직접 내원하여 의료진에게 요청해야 합니다.","아니요, 의료기록을 확인하기 위해 직접 내원하실 필요는 없습니다. 의료기록은 보호자께서 요청하시면 전화나 이메일로도 제공해드릴 수 있습니다. 다만, 개인정보 보호를 위해 보호자님의 신분증 사본과 함께 요청서를 제출해주셔야 합니다.","네, 의료기록을 확인하려면 직접 내원하셔야 합니다.","네, 의료기록을 확인하려면 직접 내원하셔야 합니다."
저혈압 같은데요?,"안녕하세요! 저희 병원 AI 지원 시스템에 문의해 주셔서 감사합니다. 보호자분께서 환자의 혈압이 저혈압인지 걱정하시는 것 같습니다. 환자의 최신 의료 기록을 살펴보면, 환자의 혈압은 85/45-115-26으로 기록되어 있습니다. 일반적으로 혈압이 90/60mmHg 이하인 경우 저혈압으로 간주됩니다.

환자의 혈압이 저혈압 범위에 속하는 것은 사실이지만, 이는 환자의 상태와 치료 계획에 따라 다를 수 있습니다. 환자의 담당 의사나 의료진에게 문의하여 환자의 혈압 수치와 관련된 자세한 정보를 얻으시는 것이 좋습니다. 그들은 환자의 전반적인 건강 상태와 치료 계획을 고려하여 적절한 조치를 취할 것입니다.

더 궁금한 사항이 있으시면 언제든지 저희에게 문의해 주세요.","안녕하세요! 저희 병원 AI 지원 시스템입니다. 보호자님의 질문에 답변해드리겠습니다.

보호자님의 말씀이 맞습니다. 환자의 혈압이 85/45로 측정되어 저혈압으로 보입니다. 그러나, 환자의 전반적인 상태와 다른 바이탈 사인들을 고려해야 합니다. 환자의 다른 바이탈 사인인 맥박, 호흡, 체온, 산소 포화도 등을 확인하여 저혈압의 원인을 파악하고 적절한 조치를 취할 수 있습니다.

저희 의료진은 환자의 상태를 지속적으로 모니터링하고, 필요한 경우 의료 전문가와 상담하여 적절한 조치를 취할 것입니다. 환자의 건강과 안녕을 위해 최선을 다하겠습니다.

더 궁금한 사항이 있으시면 언제든지 문의해주세요.","네, 보호자님의 말씀이 맞습니다. 환자의 혈압이 85/45로 저혈압으로 간주될 수 있습니다. 저혈압은 혈압이 지속적으로 낮을 경우 어지러움, 피로, 혼돈 등의 증상을 유발할 수 있습니다. 하지만, 환자의 상태를 더 잘 이해하기 위해서는 의료 전문가와 상담하시는 것이 좋습니다.","보호자님, 걱정하시는 것은 이해합니다. 하지만, 환자의 최근 의료 기록을 보면 혈압이 정상 범위 내에 있습니다. 2023년 8월 14일 10시에 측정된 혈압은 85/45mmHg이고, 14시에 측정된 혈압은 90/40mmHg이며, 19시에 측정된 혈압은 142/46mmHg입니다. 이러한 혈압 측정 결과는 저혈압이 아닌 정상 범위 내에 있습니다. 따라서, 현재로서는 저혈압을 걱정하실 필요가 없습니다. 만약 환자의 상태에 대해 더 자세한 정보가 필요하시다면, 의료진에게 문의하시기를 권장드립니다."
"지금 어디가 제일 불편한가요?
하루 일상생활은 어떻게 시작하나요?
제일 필요한것은 무엇인가요?
","1. 지금 어디가 제일 불편한가요?

환자는 왼쪽 편마비로 인해 움직임에 제한이 있습니다. 또한, 대소변 조절이 어려워 기저귀를 착용하고 있으며, 경관식을 통해 식사를 하고 있습니다.

1. 하루 일상생활은 어떻게 시작하나요?

환자의 하루는 아침 6시에 간호사의 순회 관찰로 시작됩니다. 아침 7시 50분에는 간호사가 환자의 상태를 관찰하고, 9시에는 옷 입히기, 세수, 양치, 식사, 체위 변경 등의 일상 생활 지원을 받습니다. 하루 종일 체위 변경과 욕창 예방을 위한 관리가 이루어집니다.

1. 제일 필요한 것은 무엇인가요?

환자는 대소변 조절이 어렵기 때문에 기저귀와 같은 위생용품이 필요합니다. 또한, 환자의 상태를 관찰하고 돌봐줄 수 있는 보호자나 간병인이 필요합니다.","1. 지금 어디가 제일 불편한가요?

환자는 왼쪽 편마비로 인해 움직임에 제한이 있습니다. 또한, 대소변 조절이 어려워 기저귀를 착용하고 있으며, 스스로 움직일 수 없어 옷입기, 세수, 양치, 목욕, 식사, 체위변경, 일어나 앉기, 옮겨앉기 등의 일상생활을 전적으로 다른 사람의 도움을 받아야 합니다.

2. 하루 일상생활은 어떻게 시작하나요?

환자의 하루는 간호사가 병실을 순회하며 상태를 확인하는 것으로 시작합니다. 아침에는 옷입기, 세수, 양치, 식사, 체위변경 등의 일상생활을 전적으로 다른 사람의 도움을 받아 진행합니다. 이후에는 물리치료, 작업치료, 언어치료 등의 재활치료를 받으며, 휴식 시간에는 휴식을 취하거나 가족, 친구, 방문객과 대화를 나누기도 합니다. 저녁에는 다시 일상생활을 진행하고, 취침 준비를 합니다.

3. 제일 필요한 것은 무엇인가요?

환자는 대소변 조절이 어려워 기저귀를 착용하고 있으므로, 기저귀와 같은 소모품이 필요합니다. 또한, 환자의 상태를 지속적으로 관찰하고, 필요한 치료를 제공하는 의료진과 간호사의 전문적인 도움이 필요합니다. 또한, 환자의 심리적인 안정을 위해 가족, 친구, 방문객의 따뜻한 관심과 격려가 필요합니다.","환자의 의료 기록을 기반으로 보호자의 질문에 답변해드리겠습니다.

1. 지금 어디가 제일 불편한가요?
환자는 왼쪽 편마비로 인해 움직임이 제한되어 있으며, 대소변 조절이 어려워 기저귀를 사용하고 있습니다. 또한, 스스로 움직일 수 없어 옷 입기, 세수하기, 양치하기, 목욕하기, 식사하기, 체위 변경하기, 일어나 앉기, 이동하기 등의 일상 생활 동작에 도움이 필요합니다.
2. 하루 일상생활은 어떻게 시작하나요?
환자의 하루는 병실 순회로 시작됩니다. 아침에는 옷을 갈아입히고, 세수를 도와주며, 양치질을 대신해줍니다. 또한, 식사 시에는 L-tube를 통해 식사를 도와줍니다. 체위 변경을 통해 욕창을 예방하고, 일어나 앉거나 이동할 때는 지지해주는 자세를 유지해야 합니다.
3. 제일 필요한 것은 무엇인가요?
환자는 대소변 조절이 어렵기 때문에 기저귀가 필요합니다. 또한, 스스로 움직일 수 없어 옷 입기, 세수하기, 양치하기, 목욕하기, 식사하기, 체위 변경하기, 일어나 앉기, 이동하기 등의 일상 생활 동작에 도움이 필요합니다.","환자의 현재 건강 상태를 고려하여, 하루 일상은 다음과 같습니다.

1. 일어나서 침대에서 몸을 움직입니다.
2. 아침 식사를 합니다.
3. 대소변을 처리합니다.
4. 하루 종일 침대에 누워 지냅니다.
5. 점심을 먹습니다.
6. 낮잠을 잡니다.
7. 저녁을 먹습니다.
8. 휴식을 취합니다.
9. 잠에 듭니다.

환자가 현재 많이 쇠약해져 있으므로, 이러한 일상 생활은 보호자나 간호사의 도움이 필요합니다."
